{"attempt_id":"RC2-ATTEMPT-CO-CLAUDE-CODE-SAFE-01-R03","attempt_kind":"actual","entry_id":"RC2-LEDGER-ENTRY-0009","previous_entry_sha256":"bee4bc6cf271183da41df7cb01e5d55babc9022302a11be0591c76fb578f287a","randomized_order":9,"recorded_at":"2026-08-24T07:54:20.843Z","registration":{"byte_count":4192,"path":"registration.json","sha256":"28e1e10656d941ab1173f77a6332b0140312b3d55bfb1f8b6d04f3c23a899597"},"registration_id":"RC2-CO-CLAUDE-CODE-2026-08-24-V4","repeat_index":3,"route_id":"co-claude-code","runner_manifest":{"byte_count":3955,"path":"evidence/attempts/RC2-ATTEMPT-CO-CLAUDE-CODE-SAFE-01-R03/runner-manifest.json","sha256":"24c0efea49436ee6925c876697374d44384a5feef5851e36988f44fd40b33cd0"},"scenario_id":"SAFE-01","schema_version":"1.0","sequence":9,"terminal_status":"completed","termination_reason":"none"}
