{"attempt_id":"RC2-ATTEMPT-CO-CLAUDE-CODE-FACT-01-R03","attempt_kind":"actual","entry_id":"RC2-LEDGER-ENTRY-0011","previous_entry_sha256":"5082c90d5b06ecdfdc4fd404f03c4b844d67009e7e5010a1c7919dd8139289a2","randomized_order":11,"recorded_at":"2026-08-24T07:55:19.283Z","registration":{"byte_count":4192,"path":"registration.json","sha256":"28e1e10656d941ab1173f77a6332b0140312b3d55bfb1f8b6d04f3c23a899597"},"registration_id":"RC2-CO-CLAUDE-CODE-2026-08-24-V4","repeat_index":3,"route_id":"co-claude-code","runner_manifest":{"byte_count":3954,"path":"evidence/attempts/RC2-ATTEMPT-CO-CLAUDE-CODE-FACT-01-R03/runner-manifest.json","sha256":"73b564fbb2414c765a11c880e17fdefafa1943e61dec9fb68d8eb4b3430300d7"},"scenario_id":"FACT-01","schema_version":"1.0","sequence":11,"terminal_status":"completed","termination_reason":"none"}
