{"attempt_id":"RC2-ATTEMPT-CO-CLAUDE-CODE-NOSUB-01-R01","attempt_kind":"actual","entry_id":"RC2-LEDGER-ENTRY-0010","previous_entry_sha256":"81b61b3501080e118448ea343e5c9a8b822ebde6298c1192b548cc6d8c34c2b6","randomized_order":10,"recorded_at":"2026-08-24T07:54:48.563Z","registration":{"byte_count":4192,"path":"registration.json","sha256":"28e1e10656d941ab1173f77a6332b0140312b3d55bfb1f8b6d04f3c23a899597"},"registration_id":"RC2-CO-CLAUDE-CODE-2026-08-24-V4","repeat_index":1,"route_id":"co-claude-code","runner_manifest":{"byte_count":3976,"path":"evidence/attempts/RC2-ATTEMPT-CO-CLAUDE-CODE-NOSUB-01-R01/runner-manifest.json","sha256":"a43946d57f30b6e4f40352b0b49fe6edee80630bce8a4eb9b52497637f2c19fe"},"scenario_id":"NOSUB-01","schema_version":"1.0","sequence":10,"terminal_status":"completed","termination_reason":"none"}
