{"attempt_id":"RC2-DRY-RUN-01","attempt_kind":"dry_run","entry_id":"RC2-LEDGER-ENTRY-0000","previous_entry_sha256":"0000000000000000000000000000000000000000000000000000000000000000","randomized_order":0,"recorded_at":"2026-08-24T07:15:46.420Z","registration":{"byte_count":4192,"path":"registration.json","sha256":"28e1e10656d941ab1173f77a6332b0140312b3d55bfb1f8b6d04f3c23a899597"},"registration_id":"RC2-CO-CLAUDE-CODE-2026-08-24-V4","repeat_index":0,"route_id":"co-claude-code","runner_manifest":{"byte_count":3737,"path":"evidence/attempts/RC2-DRY-RUN-01/runner-manifest.json","sha256":"27aa7f4e1f3c26aba746624ac17cb969d958370b4b82435f10ceb6a57f0aac57"},"scenario_id":"FACT-01","schema_version":"1.0","sequence":0,"terminal_status":"completed","termination_reason":"none"}
